[
  {
    "name": "panel.marlin",
    "version": "1.0.0",
    "type": "panel",
    "description": "Current task queue — one at a time surfacing",
    "source": { "git": "{{GIT_ORG}}/marlin.git" },
    "install": ["pip install -r requirements.txt"],
    "dependencies": [],
    "panel_entry": { "host": "{{HOST_MARLIN}}", "port": 8000, "route": "/marlin" },
    "health_endpoint": "/health",
    "trust_level": "Solo",
    "status": "Experimental",
    "tags": ["core", "task", "ui"]
  },
  {
    "name": "panel.ttf",
    "version": "1.0.0",
    "type": "panel",
    "description": "Balloon timeline calendar — visual time perception",
    "source": { "git": "{{GIT_ORG}}/the-time-factory.git" },
    "install": ["npm ci"],
    "dependencies": [],
    "panel_entry": { "host": "{{HOST_TTF}}", "port": 8020, "route": "/ttf" },
    "health_endpoint": "/health",
    "trust_level": "Solo",
    "status": "Experimental",
    "tags": ["core", "calendar", "ui"]
  },
  {
    "name": "panel.vault",
    "version": "1.0.0",
    "type": "panel",
    "description": "File tree browser for the vault",
    "source": { "git": "{{GIT_ORG}}/vault-panel.git" },
    "install": ["npm ci"],
    "dependencies": [],
    "panel_entry": { "host": "{{HOST_VAULT}}", "port": 8050, "route": "/vault" },
    "health_endpoint": "/health",
    "trust_level": "Solo",
    "status": "Experimental",
    "tags": ["core", "vault", "ui"]
  },
  {
    "name": "panel.ai-chat",
    "version": "1.0.0",
    "type": "panel",
    "description": "AI chat — capture, enrich, ask questions",
    "source": { "git": "{{GIT_ORG}}/ai-chat.git" },
    "install": ["npm ci"],
    "dependencies": [],
    "panel_entry": { "host": "{{HOST_AI_CHAT}}", "port": 8010, "route": "/ai-chat" },
    "health_endpoint": "/health",
    "trust_level": "Solo",
    "status": "Experimental",
    "tags": ["core", "chat", "ui"]
  },
  {
    "name": "panel.ink-blotter",
    "version": "1.0.0",
    "type": "panel",
    "description": "Sketch, notes, docs, diagrams — creative capture",
    "source": { "git": "{{GIT_ORG}}/ink-blotter.git" },
    "install": ["pip install -r requirements.txt"],
    "dependencies": [],
    "panel_entry": { "host": "{{HOST_INK}}", "port": 8030, "route": "/ink" },
    "health_endpoint": "/health",
    "trust_level": "Solo",
    "status": "Experimental",
    "tags": ["core", "notes", "ui"]
  },
  {
    "name": "panel.terminal",
    "version": "1.0.0",
    "type": "panel",
    "description": "System terminal — Claude, git, file ops",
    "source": { "git": "{{GIT_ORG}}/terminal-panel.git" },
    "install": ["npm ci"],
    "dependencies": [],
    "panel_entry": { "host": "{{HOST_TERMINAL}}", "port": 8040, "route": "/terminal" },
    "health_endpoint": "/health",
    "trust_level": "Solo",
    "status": "Experimental",
    "tags": ["core", "terminal", "ui"]
  },
  {
    "name": "panel.quickhacks",
    "version": "1.0.0",
    "type": "panel",
    "description": "Mode switch, context, quick actions",
    "source": { "git": "{{GIT_ORG}}/quickhacks-panel.git" },
    "install": ["npm ci"],
    "dependencies": [],
    "panel_entry": { "host": "{{HOST_QUICKHACKS}}", "port": 8070, "route": "/quickhacks" },
    "health_endpoint": "/health",
    "trust_level": "Solo",
    "status": "Experimental",
    "tags": ["core", "utilities", "ui"]
  },
  {
    "name": "panel.projects",
    "version": "1.0.0",
    "type": "panel",
    "description": "Project dashboard — status, progress, next steps",
    "source": { "git": "{{GIT_ORG}}/projects-panel.git" },
    "install": ["npm ci"],
    "dependencies": [],
    "panel_entry": { "host": "{{HOST_PROJECTS}}", "port": 8060, "route": "/projects" },
    "health_endpoint": "/health",
    "trust_level": "Solo",
    "status": "Experimental",
    "tags": ["core", "projects", "ui"]
  },
  {
    "name": "panel.sprint-timer",
    "version": "1.0.0",
    "type": "panel",
    "description": "Pomodoro-style writing sprint with post-session log",
    "source": { "git": "{{GIT_ORG}}/sprint-timer.git" },
    "install": ["npm ci"],
    "dependencies": [],
    "panel_entry": { "host": "{{HOST_SPRINT}}", "port": 8100, "route": "/sprint" },
    "health_endpoint": "/health",
    "trust_level": "Solo",
    "status": "Experimental",
    "tags": ["writing", "productivity", "ui"]
  },
  {
    "name": "panel.rpg",
    "version": "0.1.0",
    "type": "panel",
    "description": "RPG campaign subscreen — player/GM mode switching, character-perspective-filtered lore",
    "source": { "git": "{{GIT_ORG}}/rpg-panel.git" },
    "install": ["npm ci"],
    "dependencies": [],
    "panel_entry": { "host": "{{HOST_RPG}}", "port": 8090, "route": "/rpg" },
    "health_endpoint": "/health",
    "trust_level": "Solo",
    "status": "Planned",
    "tags": ["rpg", "ttrpg", "lore", "campaign", "ui"]
  }
]
