[
  {
    "name": "skill.marlin-capture",
    "version": "1.0.0",
    "type": "skill",
    "description": "Fast task/project capture into the inbox",
    "source": { "git": "{{GIT_ORG}}/marlin-capture.git" },
    "install": [],
    "dependencies": [],
    "trust_level": "Solo",
    "status": "Experimental",
    "tags": ["capture", "core"]
  },
  {
    "name": "skill.scribe-digest",
    "version": "1.0.0",
    "type": "skill",
    "description": "Parse writing-technique content against Tori's method",
    "source": { "git": "{{GIT_ORG}}/scribe-digest.git" },
    "install": [],
    "dependencies": [],
    "trust_level": "Solo",
    "status": "Experimental",
    "tags": ["writing", "learning"]
  },
  {
    "name": "skill.marlin-enrich",
    "version": "1.0.0",
    "type": "skill",
    "description": "Process raw notes, find connections, create atomic notes",
    "source": { "git": "{{GIT_ORG}}/marlin-enrich.git" },
    "install": [],
    "dependencies": [],
    "trust_level": "Solo",
    "status": "Experimental",
    "tags": ["vault", "enrich"]
  },
  {
    "name": "skill.quota-guard",
    "version": "1.0.0",
    "type": "skill",
    "description": "Weekly quota check for build budgeting",
    "source": { "git": "{{GIT_ORG}}/quota-guard.git" },
    "install": [],
    "dependencies": [],
    "trust_level": "Solo",
    "status": "Experimental",
    "tags": ["quota", "build"]
  },
  {
    "name": "skill.marlin-close",
    "version": "1.0.0",
    "type": "skill",
    "description": "Evening anchor ritual — close the day",
    "source": { "git": "{{GIT_ORG}}/marlin-close.git" },
    "install": [],
    "dependencies": [],
    "trust_level": "Solo",
    "status": "Experimental",
    "tags": ["daily", "anchor"]
  },
  {
    "name": "skill.marlin-open",
    "version": "1.0.0",
    "type": "skill",
    "description": "Morning anchor ritual — open the day",
    "source": { "git": "{{GIT_ORG}}/marlin-open.git" },
    "install": [],
    "dependencies": [],
    "trust_level": "Solo",
    "status": "Experimental",
    "tags": ["daily", "anchor"]
  },
  {
    "name": "skill.marlin-build",
    "version": "1.0.0",
    "type": "skill",
    "description": "Build workflow for Marlin features",
    "source": { "git": "{{GIT_ORG}}/marlin-build.git" },
    "install": [],
    "dependencies": [],
    "trust_level": "Solo",
    "status": "Experimental",
    "tags": ["build", "workflow"]
  },
  {
    "name": "skill.economic-precarity",
    "version": "1.0.0",
    "type": "skill",
    "description": "Guide community members through economic precarity",
    "source": { "git": "{{GIT_ORG}}/economic-precarity.git" },
    "install": [],
    "dependencies": [],
    "trust_level": "Solo",
    "status": "Experimental",
    "tags": ["community", "guidance"]
  },
  {
    "name": "skill.lgbtq-affirmation",
    "version": "1.0.0",
    "type": "skill",
    "description": "LGBTQ+ affirmation and structural support",
    "source": { "git": "{{GIT_ORG}}/lgbtq-affirmation.git" },
    "install": [],
    "dependencies": [],
    "trust_level": "Solo",
    "status": "Experimental",
    "tags": ["community", "affirmation"]
  },
  {
    "name": "skill.sex-positivity",
    "version": "1.0.0",
    "type": "skill",
    "description": "Sex-positivity and relationship diversity advisory",
    "source": { "git": "{{GIT_ORG}}/sex-positivity.git" },
    "install": [],
    "dependencies": [],
    "trust_level": "Solo",
    "status": "Experimental",
    "tags": ["community", "relationships"]
  },
  {
    "name": "skill.project-reload",
    "version": "1.0.0",
    "type": "skill",
    "description": "Load project context into working memory",
    "source": { "git": "{{GIT_ORG}}/project-reload.git" },
    "install": [],
    "dependencies": [],
    "trust_level": "Solo",
    "status": "Experimental",
    "tags": ["project", "context"]
  },
  {
    "name": "skill.job-assess",
    "version": "1.0.0",
    "type": "skill",
    "description": "Assess job listings for compatibility",
    "source": { "git": "{{GIT_ORG}}/job-assess.git" },
    "install": [],
    "dependencies": [],
    "trust_level": "Solo",
    "status": "Experimental",
    "tags": ["career", "assessment"]
  },
  {
    "name": "skill.louisoix",
    "version": "1.0.0",
    "type": "skill",
    "description": "Community care integration advisor",
    "source": { "git": "{{GIT_ORG}}/louisoix.git" },
    "install": [],
    "dependencies": [],
    "trust_level": "Solo",
    "status": "Experimental",
    "tags": ["community", "care"]
  },
  {
    "name": "skill.ttf-push",
    "version": "1.0.0",
    "type": "skill",
    "description": "Sync tasks to The Time Factory calendar",
    "source": { "git": "{{GIT_ORG}}/ttf-push.git" },
    "install": [],
    "dependencies": [],
    "trust_level": "Solo",
    "status": "Experimental",
    "tags": ["calendar", "integration"]
  },
  {
    "name": "skill.neurodivergence-care",
    "version": "1.0.0",
    "type": "skill",
    "description": "Neurodivergence-informed community care",
    "source": { "git": "{{GIT_ORG}}/neurodivergence-care.git" },
    "install": [],
    "dependencies": [],
    "trust_level": "Solo",
    "status": "Experimental",
    "tags": ["community", "neuro"]
  },
  {
    "name": "skill.mental-health-first-response",
    "version": "1.0.0",
    "type": "skill",
    "description": "Mental health first response for community stewards",
    "source": { "git": "{{GIT_ORG}}/mental-health-first-response.git" },
    "install": [],
    "dependencies": [],
    "trust_level": "Solo",
    "status": "Experimental",
    "tags": ["community", "crisis"]
  },
  {
    "name": "skill.trauma-informed-care",
    "version": "1.0.0",
    "type": "skill",
    "description": "Trauma-informed community care advisory",
    "source": { "git": "{{GIT_ORG}}/trauma-informed-care.git" },
    "install": [],
    "dependencies": [],
    "trust_level": "Solo",
    "status": "Experimental",
    "tags": ["community", "trauma"]
  }
]
